<!ELEMENT  bookstore (book+)>
<!ELEMENT  book (id, name, noofpages, author , price)>
<!ELEMENT id (#PCDATA)>
<!ELEMENT name (#PCDATA)>
<!ELEMENT noofpages (#PCDATA)>
<!ELEMENT author (#PCDATA)>
<!ELEMENT price (#PCDATA)>
